recommendationid,appid,language,review,voted_up,votes_up,votes_funny,weighted_vote_score,playtime_forever,num_reviews,timestamp_created
213157332,949230,russian,"Что же, настало время обзора после первого прохождения игры с нуля до мегалополиса. Я считаю что этого времени вполне достаточно для того что бы написать обзор. Я фанат первых скайлайнсов и искренне люблю эту игру, но вторая часть в ноль убила желание играть в градострои от пароходов. Игра абсолютно не оправдывает свой конский ценник даже спустя 2 года фиксов. Регулярные вылеты по до сих пор неизвестным мне причинам, ублюдская баганная экономика, отсутствие оптимизации как таковой если 4060 i9 32 рам-ы не вывозит в 60 фпс даже начальный этап игры. С какого-то момента играть просто невозможно без временного подключения бесконечной валюты. Экономика ломается буквально на ровном месте и уходит в глубокие минуса без шанса что-то исправить. Вкручивал расходы на 0, убирал службы - ничего не помогает. И это лишь малая часть. Баги отображения шейдеров, текстур... У пароходов было 2 блядских года что бы пофиксить их детище. Итог - тонна ♥♥♥♥♥ не сдавшегося радио и платных длс и ни одного пофикшеного бага с момента релиза. Еще один краеугольный камень - трафик. Как бы в описании игры не писали что он умный, иишный, адаптируемый - по факту настолько же тупой как и в первой части игры. Перестройка прямо перед развязкой длинной в пол метра, что создает пробки, такие же ублюдские волны трафика при постройке новых зданий как и в первой части. И это не решаемо, у вас нет инструментария что бы решить проблему, даже моды не вывозят идиотизма его поведедения, машины и дальше будут создавать фантомные пробки на ровном месте из-за тупизны, какие бы развязки не строились, какие бы меры не принимались. Единственное что радует - синематик виды как из трейлера, которые портят уебанские ассеты одних и тех же зданий. Ради рофла я сносил и строил здания малой средней высокой плотности минут 12 и насчитал 4-6 моделек на каждый тип. Короче, вместо красивейшего города вы получаете аналог типовых хрущей с различиями только по цвету и 2 пропами. Я КАТЕГОРИЧЕСКИ НЕ РЕКОМЕНДУЮ ИГРУ К ПОКУПКЕ, даже пиратству. Я попробую сделать еще пару прохождений дабы возможно заметить те детали, которые упустил во время первого, но общую картину это не изменит. Играйте в первую часть с модами на графу и не тратьте свое время на этот кусок игро-калла собранного индусами на демке юнити UPD: Как и обещал апдейт после 90 часов и 3 прохождений на счету с нуля до мегалополиса. Еще с первого прохождения я был очень уверен что это со мной что-то не так и потребность в большинстве своем используется на жилую зону малой плотности. Я перепробовал все способы увеличивать стоимость земли: ставил огромные парки, школы, университеты, огромные расходы на полицию. Стоимость земли перешагнула отметку в 423 внутриигровой валюты за клетку. А теперь вопрос на миллион: на сколько выросла потребность в жилых зонах средней/высокой плотности? НА 0 ♥♥♥♥♥. Нету никакой градации и зависимости от стоимости земли или нужд горожан для типа запрашиваемой жилой/комерческой зоны. Как бы разработчик не объяснялся что высокая плотность нужна студентам близ университетов…одиноким людям и подобная ложь разработчика - оно никак не влияет. Все мои университеты в 2/3 городах заставлены на километры вокруг частными домами с землей под 300+ ценой за клетку. Представьте ♥♥♥♥♥ ситуацию как в городе миллионнике большую часть жилья предоставляют ♥♥♥♥♥ частники, а самым высоким зданием в городе является пожарная часть или даже ♥♥♥♥♥♥ ларек с хлебом откуда можно увидеть весь город. Редкая потребность в жилых зонах средней/высокой плотности выглядит как подачка от игры. Ты висишь над «центром города» часами в ожидании того как игра соизволит выдать тебе хотя бы 4 здания средней плотности.  А потом эта же самая игра будет тебя пиздить лопатой за то что у тебя нет рынка труда и наличия клиентуры в смешанных зонах. И это не лечится, только мод-чит на постоянную потребность в зданиях всех видов. Я нашел много уебищных моментов за эти 3 прохождения(Не работающий транспорт, мертвое образование, ЕБУЧИЕ ВЕЛОСИПЕДИСТЫ КОТОРЫЕ СОЗДАЮТ ПРОБКИ ДЛИННОЙ В ЧЕТВЕРТЬ КАРТЫ, велосипедисты которые мешают трафику сквозь запрет на проезд велосипедам по дорогам общего пользования), но с каждым новым разом у меня складывается ощущение что инвалиды не разрабы, а я, ведь с каждым новым разом мне нужно все больше костылей что бы вытягивать крупицы удовольствия из этой игры.",False,65,4,0.802044212818145752,7525,4,1765585374
213019755,949230,russian,"Ещё года 2-3 бы поработали, и было бы играбельно, а так профукали поддержку Collosal Order, можно про улучшение игры забыть  p.s. игра стала неиграбельна при населении 700к, авто практически не двигаются, жуткие фризы",False,0,0,0.5,11462,14,1765415845
212968260,949230,russian,"Спустя несколько лет после релиза игра продолжает вылетать на ровном месте даже на крайне мощном ПК, долгие загрузки, низкий фпс, в общем просто отвратительно.",False,2,0,0.52173912525177002,7733,3,1765354932
212877191,949230,russian,Ну такое   1я часть по лучше и понятнее,False,3,0,0.54356849193572998,1311,5,1765231290
212788850,949230,russian,"Оптимизация ноль, зря потратил деньги!",False,1,0,0.523809552192687988,2225,2,1765125735
212776498,949230,russian,"С учетом того, что это ""Cities: Skylines"", а не какой-то no-name тайтл сделанный кем то без опыта, и именно на этом делались продажи - это позорище, стыд и разочарование, на котором нажились. Не хочу тратить время на обосновывание дизлайка, все сказано в отзывах других игроков. 2 года прошло, теперь разработчика меняют, самое время уже поставить негативный отзыв.",False,56,3,0.775019705295562744,4724,3,1765115464
212729311,949230,russian,"Отвратительная оптимизация, игре уже 2 кода, а она нормально работать не может. Постоянные вылеты и запускается с 3 раза. Ужас. К покупке не рекомендую. Как можно было не исправить такие недочеты за 2 года?",False,0,0,0.5,1120,1,1765060148
212679429,949230,russian,"спустя два года, игра все еще сырая и багованая. моды обновляются неудобно, контента от разработчиков мало. а платные креатор паки это вообще что такое - мы по сути должны платить за моды? почему после последнего обновления, при выборе режима расставления деревьев, у меня пропадает интерфейс. исправьте, пожалуйста",False,0,0,0.5,12758,1,1765015066
212639078,949230,russian,DLC!! - они должны быть изнач в игре а не за 6 к и более,False,4,0,0.542725205421447754,8261,6,1764965869
212629932,949230,russian,"Too many bugs, too many paywalls hiding beautiful and kinda realistic city building sandbox",False,1,0,0.488867372274398804,29686,11,1764957091
212623824,949230,russian,"Это неоптимизированный кусок кала, господи, не стоит отдавать свои деньги, за это ""добро"" Первая часть шикарна! Ставьте моды и будет вам счастье.",False,1,0,0.483870983123779297,926,1,1764951358
212592684,949230,russian,"Игра прикольная, я ее очень ждал (особенно когда начал на PS, и надеялся, что эта часть тоже туда выйдет, а меня кормили завтраками).   Игра на PS так и не вышла, оптимизацией так и не вышло..   Куча того, что было в первой части тоже отсутствует.. Графика красива, новая система дорог тоже нравится, но политики, отсутствие некоторых механик и в целом плохой релизный продукт - это беда..  Чувства смешанные, вроде и прикольно, но не за фулл прайс.. и DLS за деньги, которые радикально ничего не добавляют.. И то, что сняли Colossal Order с разработки, это кажется финальный аккорд этой игры.. Дальше лучше не будет.. В лучшем случае останется так же, а в худшем сделают еще хуже (куда уж хуже то)..",False,2,0,0.5,2020,1,1764909824
212570443,949230,russian,"Приобрёл игру ещё на релизе, когда первый раз в неё зашёл был удивлён от оптимизации данного продукта, а точнее её отсутствии. Тогда я подумал, ну мол игра новая, только вышла, надо немного потерпеть, подождать и будет вообще кайф, всё таки разработчики по идее ребята умные так ведь?... Но спустя 2 года особо оптимизации не прибавилось. Уже если честно привык к 30 ФПС когда населения под 30К, играю на средних настройках. Платный контент это конечно П###ЕЦ, ну не могут эти ДЛС стоить хоть каких то денег, как по мне они очень пустые, сделаны на ОТ##ИСЬ. А радиостанции платные тоже ТРЕШ, отвалить денег за пару других мелодий... Спасибо что есть моды, они делают этот сырой кал намного приятнее и играбельнее. Потенциал у игры огромный, но бл 2 ГОДА и никаких заметных улучшений, они наверно будут когда я уже перестану играть в комп и то не факт. Вообще почему решил написать отзыв, после обновления, моды конфликтуют с новой версией игры и некоторые не работаю, благодаря чему всё движение транспорта в моём городе встало, вот и пригорело у меня. Спасибо за внимание)",False,72,3,0.838728725910186768,12029,1,1764881009
212559280,949230,russian,говно,False,0,0,0.492217898368835449,16544,5,1764870120
212541056,949230,russian,говно которое не работает нормально,False,0,0,0.5,6508,1,1764851860
212525285,949230,russian,"Не понимал негативных отзывов до этого, без каких либо проблем отыграл 150 часов в игру, но что вы ♥♥♥♥♥ сделали с системой водоснабжения и отчистными станциями, это ♥♥♥♥♥♥, спасибо за сломанный к ♥♥♥♥ сейв на 70к населения",False,0,0,0.5,11149,7,1764826474
212407844,949230,russian,"Вышла сырой, но это ладно. Спустя 2 года даже оптимизацию не смогли нормально сделать. Я уже не говорю про все эти обещанные фичи, типа продвинутого ии для выбора маршрута горожан и экономической симуляции. Теперь колосал ордер вообще сняли с проекта.  Я давал большой кредит доверия этой игре на релизе, но спустя 2 года, я так и не готов ее рекомендовать.",False,6,0,0.531857132911682129,8842,14,1764685430
212355221,949230,russian,-Смотрите у нас скоро патч выйдет за ценю с полную игру!!!! -Но у нас вылетает игра и мы не можем зайти и нормально поиграть. -Разбирайтесь сами. У нас платные длс на подходе!,False,113,6,0.847069442272186279,12449,1,1764615758
212218223,949230,russian,"Вместо исправления раздражающих багов, которые судя по постам в реддите и стиме были еще 2 года назад разработчики улучшают веложизнь. С модами боль в жопе становится не такой сильной, при этом 0 из них для дополнительного контента, только исправление кривого интерфейса/настроек самой игры. Очень жаль что все такие нюансы, которые наваливаются как снежный ком, нельзя ощутить в первые 2 часа игры. Поскольку заплатил деньги, протестирую все что она предлагает из контента. Не исключаю что такой недалекий геймер как я за 40 часов не понял как правильно строить дороги, почему машины упорно лезут пробку когда есть еще много вариантов заездов с разных сторон, задержка на светлофорах  это вообще пропасть..",False,1,0,0.5,2511,2,1764557832
212096861,949230,russian,"Похоже кто-то из разрабов сильно ненавидел тетради в клетку, поскольку я иначе не могу объяснить отсутствие сетки в меню строительства дорог. Типа, раньше, чтобы построить кольцевую развязку, я мог спокойно вручную начертить нужную мне фигуру, со всеми съездами и т.д. Здесь же, из-за отсутствия этой сраной сетки, я чувствую себя дедом страдающим от паркинсона, поскольку любоя мало-мальски симетричная фигура или задумка разбивается о необходимость ЧЕРТИТЬ! Типа, единственный инструмент зонирования у тебя, это привязка к углам уже отстроенной дороги и это ♥♥♥♥♥♥ как неудобно. Они вообще в свою игру играли? Мне реально надо лезть в мастерскую чтобы поставить мод на дорожную сетку?",False,2,0,0.516994297504425049,45,132,1764530401
211829740,949230,russian,"Не покупайте игру. Она умерла. Я залип в эту игру на многие часы и просто не мог оторваться. Но на ноябрь 2025 игра сильно недоделана. Пока у вас маленькая деревня на 10-20тыс человек, вы не заметите серьезные минусы: 1. Не работает экспорт. Ваш город растет, растут рабочие места и потребности. Вы строите заводы, но ресурсы с них уходят только на внутренний рынок. В какой-то момент у вас просто забиваются все склады. Можно прокладывать любые линии по суше или морю, но товары не экспортируются. 2. Из п.1 частично вытекает п.2 с неработающими налогами. В теории налоги должны улучшать качество жизни и доход от экспорта, но эта механика тоже не работает. Качество жизни растет по больше части от других факторов, а экспорт не работает, так что можно тупо задирать налоги по мере возможности. 3. Не работает механика общественного транспорта. Можете сделать любые ветки общественного транспорта, но все тупо упирается в плотность населения. Велосипедисты вообще поломали игру создавая жесткие пробки и постоянно жалуясь на отсутствие выделенных дорожек, хотя они у меня были везде. 4. Дерево развития очень короткое и вы достигаете максимума довольно быстро. 5. Туризм работает плохо и вообще не понятно от чего зависит. Во-первых, на пуски ракеты вообще не ходят зрители, а гугл говорит что эту часть разрабы просто не сделали. Во-вторых, у меня при максимальном количестве туристических объектов, но разном населении, туризм сначала поднялся до 12млн, а потом упал до 3млн. Может туризм бывает только внутренним и зависит от твоего населения. Т.е. ты не можешь сделать маленький туристический город и жить с этого дохода.  В итоге, зайдите на стримы по игре и посмотрите чем занимаются игроки. Зачастую просто ландшафтным дизайном, а не городскими проблемами. Я для себя ставил цель сделать уютный маленький город без пробок и достиг этого за пару десяткой часов перестраивая несколько раз город, борясь с пробками. Получил море удовольствия, но понял что второй город строить уже не хочу. Экономика почти не работает. Почти нет никакого разнообразия ни в строительстве, ни в управлении городом. Законов всего около десяти и половина вообще бесполезная. Общественный транспорт работает непонятно как. Но вишенка на торте что из-за сложной системы симуляции игра у меня начала тормозить при населении в 40тыс (такое количество людей можно легко получить менее чем за десять часов) из-за чего пришлось снижать до 30тыс. Разработчики не выпускают заплатки, которые бы чинили игру, а вместо этого делают платные бесполезные дополнения и то редко. Похоже игра умерла.",False,4,0,0.568345308303833008,11090,28,1764489369
211449478,949230,russian,"Забыл раньше написать, разраб просто ********, заплати за игру и еще отдельно за деревья, дом, башню и тд Просто сосут не *** а деньги ....",False,2,1,0.536359429359436035,980,12,1764347954
211413137,949230,russian,"а давайте поставим много деняг за игру и нифига не будем делать оптимизацию, даже на топовом железе все ужасно фризит",False,2,0,0.538305461406707764,7590,3,1764340194
210810527,949230,russian,Serious optimization is needed! I'm playing on a 3080ti at 20-30fps. It's impossible to play now when the city is large,False,2,0,0.52173912525177002,1937,10,1764149344
210022045,949230,russian,Багов море,False,0,0,0.5,4224,2,1764003899
