recommendationid,appid,language,review,voted_up,votes_up,votes_funny,weighted_vote_score,playtime_forever,num_reviews,timestamp_created
196396802,949230,russian,"Лаги, баги, краши и вылеты.    Cities Skylines 1 стала для меня залипалкой, отнявшей ни одну тысячу часов. Анонс второй части обнадежил - прекрасную игрульку доведут до ума, насытят графикой и будет нечто. Увидев отзывы на релизе, я решил повременить с покупкой, по итогу взял после выхода DLC Modern Architecture, Urban Promenade.    По порядку.  Плюсы:  1. Графика. Стало лучше, но не сильно. К примеру, текстуры травы или дороги просто смешные. Жители как были куклами, так и остались (только каррикатурнее). Ну, допустим. В остальном графику подняли, спорить глупо. Можно собрать приличные, зрелищные города для красивых скринов (только для них).  2. Карты - места стало больше, спасибо. Минус один мод по клеткам. Удобны соединения с другими городами, все продумано и удобно.  3. Апгрейд зданий - мелочь, стыренная с шестого СимСити, но актуальная. Это приятная вещь.  4. Региональные паки - пожалуй лучшая идея по этой игре. Воплощена на троечку (особенно французский или японский пак), но все же был удивлен их бесплатности. Приятно.  5. Депо и стоянки + стоянки служебного транспорта. Это добавляет жизни, это хорошее нововведение.  6. Дороги. Стало в разы легче их строить + порадовали апгрейды, в том числе трамвайных путей. Порадовали варианты настроек. Конечно не Traffic Manager, но определенно удобнее.  7. Механика с бездомными. Идея отличная, воплощение с багами через жопу. Сделаем скидку, что исправят.  6. Редактор поверхностей. Это удобно для проработки деталей. Факт.    Минусы:  1. Терраформинг и строительство. Это просто позор после первой части. Что вы сделали с сеткой? Почему при идеальной ровной дороге дома строятся как попало. Из-за таких нововведений фанаты перфекционизма повесятся. Про рельеф то же самое - дома мало того, что непонятно как лежат на сетке, так еще и строятся через жопу на склонах. Зачем было ломать адекватную систему первой части?  2. Экономика и промышленность. Ее просто не существует. Создав первый город на бесконечных деньгах и настроив кучу всего для анализа механик, я был в шоке от того, что мой баланс был +2 млн. Что с импортом/экспортом? Что с промышленностью? Зачем вы ее убили?  3. Поведение жителей. Да-да, вы обещали, что жители станут осмысленее, а их жизнь я буду ощущать, не так ли? Не будет ведь лагов с переездами, сменами работы и др?)))  4. Безжизненность. Да, именно она огорчила. Парки выглядят как простые клетки. Даже анимация жителей в них минимальная. Вспомните анимации в первой части, особенно в зимних парках. Вспомнили? Забудьте.    Ну а теперь самое важное.    5. Оптимизация - вы совсем охренели? на моей RTX 4070Ti игра шла с 20 FPS. Да, вы клятвенно обещали исправить и работаете над этим, но насколько удалось все исправить?))  6. Контент - игра полупустая. Все наработки первой части смыты в унитаз, мы теперь это будем покупать за денюжки.  7. Вытекает из пятого - качество дополнений и пакетов. На данный момент оно никакое. Ни одно дополнение на данный момент игру не украсило. Я купил все наборы как фанат игры, на деле пустая трата денег.  8. Мастерская. Это просто провал. Отказаться от мастерской steam, добавив все в paradox mods? Ок, схавали. Где редактор? Сколько времени прошло с релиза? Игра, держащаяся на аддонах, не может жить, если аддонов просто нет.  9. Решающее для меня - баги и вылеты. Безусловно, сырой релиз, работа над оптимизацией проводится. Но регулярно 3-5 раз в неделю я ловлю вылеты на всем подряд. Последние две недели я просто не могу зайти в свой город, потратив на него 105 часов. Просто позор. Игра падает, вылетает, шлет репорты и все подряд. Почему я должен об этом париться, заплатив деньги?    Я категорически не рекомендую данную игру к покупке. Компания вкрай потеряла совесть и нацелена лишь на отмыв бабла. Продукт крайне перспективный, но абсолютно сырой. За время с релиза работа над ошибками практически не проведена, играть в нее некомфортно даже на топовом железе. Зато аддоны и DLC анонсируют. Искренне желаю оставаться в первой части или надеюсь на тот факт, что игру подлечат, либо ждать релизы конкурентов.    2/10.",False,139,1,0.887999773025512695,24379,6,1749060035
196291010,949230,russian,"Игра не очень плохая но и пока что рекомендовать не могу, оптимизация слабая, транспорт реализован лучше чем в первой части, но где троллейбусы? Еще убрали монорельс, канатную дорогу, автобусы на биотопливе(заменили на электробусы, но как по мне это немного разное, туристические автобусы, вертолёты и дирижабли, но как по мне это не очень популярный транспорт в мире по сравнению с троллейбусами. Ещё подбешивают трамвайные рельсы, ведь разрабы решили что с каждого пути должен быть путь на каждый путь, и эти пути превращяются в кашу из путей. Поставил остановку близко к стрелке? у тебя трамваи могут поехать как надо, а могут и под другой трамвай, застрять, и удалиться, и это будет постоянно, пока ты это не исправишь и к тому же почти нет вариантов транспорта, в первой части они были, а тут максимум ""электробус или обычный автобус на линию пустить?"". Крытых трамвайных остановок нет, в первой части на определённых типах дорог были, а тут ну вот нигде нет. Также отмечу что из + это возможность создавать новые междугородние транспортные связи, но кроме авиа связей, которые тоже очень хотелось бы добавлять (ну и трамвайные или метро связи нельзя, что логично).    В игру не особо получиться спокойно играть, не опасаясь вылета, ошибки, или зависания. Мелкие баги вы даже перестанете замечать, потому что их очень много. Уже который год с достижение ""долговая яма"". На облачные сохранения не надейтесь, у меня пропал город на 570 тысяч людей, на который я потратил более 130 часов. После 200-300 тысяч людей игра у меня подвисала постоянно, а на 570 тысячах тупо вылетает(это число зависит от процессора). После 100-200 тысяч людей экономика превращается в ""держи минимальную безработицу и зарабатывай 100-ни тысяч денег"". Кредиты стали не привязаны к определённой сумме и это хорошо но, ты платишь лишь проценты а гасить автоматом ты их не можешь + здания из региональных наборов(и я почти уверен что и из DLC) снижают этот процент и может быть ситуация когда ты должен много миллионов денег но ты ничего не платишь, ведь у тебя 5 мерий и центробанк.     Работать с дорогами стало проще, удобнее и они стали более гибкими нежели в 1 части. Взаемодействие зданий и рельефа, лично мне, больше нравиться в первой части, тут здания полностью подстраиваются под рельеф, например малая ж/д станция может быть построена на холмистом рельефе, и пути подстроятся под рельеф, а  платформа нет, и у тебя поезд производит посадку высадку в стены, а люди телепортируются вверх на платформу и из платформы люди телепортируются в поезд, когда на уровне где должны быть рельсы, находятся провода питания поездов, и это я привёл просто как пример, без несколько часовой работы с рельефом, красивый город не построить никак. Появилась интернет связь, почтовые ящики, с патчем добавили малое почтовое отделение, которое до сих пор не работает. Отопления нет, а в первой части было. Система времени довольно спорная, ну вот как в реальном мире за 2 года построить город на несколько сотен тысяч людей, и их туда заселить, обычно дома высокой плотности строятся в реальном мире годами. Анимацию строительства упростили до нельзя по сравнению с первой частью. Жилые здания стали выглядит больше, высокая плотность начального уровня из 1 части, тут только на среднюю выглядит, и это +. Модульность прикольная но не хватает большего количества пристроек, также относительно зданий служб из самой игры и из региональными паками есть дизбаланс в сторону последних, ты и/или платишь за обслуживание меньше за такой же(а то и больший) объём предоставляемых услуг, и/или места меньше занимают. Катастрофы тоже кастрированы, ни нормальной разрушаемости зданий от них, ни возможность самому их запустить. Добавили круговые развязки и круговые тупики, которые дублируют друг друга.    Районные политики были урезаны до пары штук и были разделены с городскими политиками, которых тоже минимум минимума, убрали велодорожки, люди готовы платить и 20% налогов, а в первой части даже с максимальным счастьем 13% не поставишь, убрали регулировку налогов по зонам заменив по образованности(для жилых зданий) и специализации(для остальных типов), и  единственный + новой системы, можно лучше стимулировать заинтересованность в высшем образовании. Люди готовы месяцами идти на работу через весь город, а сами они стали намного терпеливее, нежели в первой части. Наконец то стали писать от чего зависит потребность в определённых зонах в игре. Карта стала больше, а покупаемые клетки стали меньше, но дают их не по 1 а по несколько штук, что позволяет более гибко расширять доступную карту для застройки, но как и в первой части, всю карту тебе никто застроить не даст. Появилась роза ветров(это когда на карте есть ветер который гонит воздух в разных направлениях с разной скоростью), и это очень хорошо, ведь теперь нельзя поставить большую угольную электростанцию посреди города, огражденной 2 кварталами коммерции/ деловой зоной, теперь надо учитывать что эта электростанция может завонять пол города из-за того, что ты поставил электростанцию так, что ветер проходя через неё заходит в твои жилые районы. Дамбы имбалансны, строительство её дорого стоит, но стоимость обслуживания фиксирована, используя инструменты рельефа можно упереться в максимум 20 ГВт, лишь бы их как то от дамбы отвести заграницу, и вот 100000 расходов на обслуживание в месяц превращаются в пару миллионов прибыли в месяц. Добавили в последнем(на момент написания) обновлении набережные для дорог, и их намного легче можно построить, НО для пешеходных улиц(именно улиц, не дорожек, ведь дорожкам дали) набережную не дали, и единственный лёгкий способ построить набережную  с таким типом дорог - построить набережную при помощи добавленной набережной для двухполоски, а потом эту двухполоску заменить на пешеходную. Не добавили набережную и для шоссе, и для больших дорог. Добавили двух ярусный мост наверху шоссе, снизу поезда, хотелось бы такой же мост, может и не не шоссе а обычная 4 или 6 полоска а снизу пути метро, ведь прокладывать тоннели под речкой это отдельный вид самопыток.    Игра выглядит лучше чем первая часть(кроме травы), но видеокарта нужна сильная а иначе вылеты или мыло с ультраапскейлером на очень низких. Я до сих пор не могу понять, зачем заменили понятные с первого взгляда 2D иконки на более непонятные 3D. DLC тоже спорные, потому что сейчас из DLC только региональные наборы за деньги, и музыка, которую я выключаю из-за имитации радио, из-за чего музыку толком не послушать, а стоит немалых денег.   А что в итоге? А в итоге игра сейчас сырой фундамент, на которую налепят 100500 DLC, стоимостью в годовой бюджет Зимбабве за 10 лет, и будет норм, а там возможно и 3ю часть выпустят. И самое главное, разрабы до сих пор не выполнили свои обещания, как минимум нельзя построить ""город мечты"", ведь игра фундаментально этого не может позволить. Я не беру моды которые закрыли бы часть -, ведь почему я должен искать, устанавливать, мучатся что бы они корректно работали, если, как по мне, это должно быть в оригинальной игре, а не добавлено/исправлено самими игроками. Как-то так.",False,20,1,0.670298993587493896,11889,5,1748926589
196251967,949230,russian,"Первая часть была настоящим хитом — легендой градостроительных симуляторов с гигантским комьюнити и тоннами модификаций. Да, DLC критиковали: за навязчивый монетизированный контент, сырые механики и вырезанные из базовой игры фичи. Но это же «классика Paradox»! Сохранила ли вторая часть гений оригинала и исправила ошибки? Нет. Вместо эволюции — шаг назад.  Вторая часть это:  1. Минорный визуальный апгрейд. Графика стала чуть более гладкой, чуть более детализированной.   2. Встроенный функционал некоторых популярных модов (по крайней мере частично). В основном это коснулось строительства дорог.  Все. Буквально, на этом нововведения заканчиваются. При этом игра значительно беднее в геймплейном плане, в игре все еще абсолютно сломан общественный транспорт (им просто никто не пользуется), в игре сломано образование, странная экономика, ОТВРАТИТЕЛЬНАЯ оптимизация. При этом Парадокс додумались выпилить моддинг через мастерстую Steam, теперь все через парадокс моды или ручками, с Нексуса. Вот только ""прекрасный"" парадокс моддинг пару раз просто сбрасывал все мои моды, без мод менеджера Skyve пользоваться им невыносимо. При этом, как я понял, Парадокс узурпировала себе право добавлять в игру новые ассеты, так что прощайте мои великолепные паки зданий от Мурки из первой части, теперь только ждать, когда разрабы кинут кость.   А ведь игру можно было сделать крутой. Еще больше расширить функционал строительства дорог, сделать создание своих дорог (не через мод), сделать большее разнообразие зданий (не только прямоугольник, прямоугольник стена-к-стене и угловой прямоугольник, а, например, здания сложной формы, круглые итд итп.), сделать генератор случайных карт для большей реиграбельности, добавить больше различных служб. Но нет, покупайте ДЛС и терпите, а часть вещей, которые было бы интересно увидеть, скорее всего вообще никогда не будет реализована. Потраченного времени жать, троекратно переваренный кал.",False,6,0,0.586148917675018311,3776,8,1748881162
196086934,949230,russian,лаунчер не работаэ в ций игри,False,0,0,0.5,11619,3,1748711638
196066640,949230,russian,мммммм ну и гавно,False,2,0,0.508928596973419189,388,20,1748695395
196054650,949230,russian,"Что мне понравилось: - реалистично выглядящее здание - улучшенная симуляция города - приятная графика, менее мультяшная, чем в CS1  Плохие: - в течение многих лет, начиная с CS1, разработчики даже не удосуживались внедрять в моды такие функции, как traffic manager, build anarchy, find it и многие полезные для сообщества моды. вместо этого они делают недоделанную игру, которая, как правило, вылетает при сильной модификации. - Игра вылетает из строя при нажатии на функцию mods в игре, что очень раздражает. - долгое время загрузки, когда я добавил 4 пакета тематических обновлений для создания контента. - игра уже 1 год не работает с исправлениями. - Дополнения. проклятие игр Paradox. чтобы получить полный опыт, нужно купить небольшое дополнение к контенту, которое стоит довольно дорого, что является самой жалкой бизнес-моделью игры Paradox.  для меня это неоднозначная ситуация.с одной стороны, я люблю игры по строительству городов, с другой - ненавижу то, что разработчики и paradox сделали с этой игрой. Если бы только Simcity вернулся...",False,1,0,0.518518567085266113,147,27,1748683094
