recommendationid,appid,language,review,voted_up,votes_up,votes_funny,weighted_vote_score,playtime_forever,num_reviews,timestamp_created
227634069,949230,russian,"Поставил дамбу, и река затопила мой город! Теперь у моих жителей есть отличный аквапарк!",True,0,0,0.5,3936,7,1781092135
227474832,949230,russian,топ игра всем советаю,True,0,0,0.5,2335,2,1780910763
227271024,949230,russian,ргшпгшнщ,True,1,0,0.523809552192687988,1800,15,1780699227
227179892,949230,russian,"На само деле игра очень интересная и захватывающая. Последнее во что играл из градостроительных симуляторов - Simcity. В сравнении с ней, это просто небо и земля!!! Можно делать что угодно и как угодно. Однозначно рекомендую.",True,0,0,0.5,2465,5,1780599927
227105674,949230,russian,игра на пару минут,True,0,4,0.476190477609634399,61202,2,1780512172
227076522,949230,russian,Замечательный геймплей игры буквально оджно не ровное движение и ты погребен в яме долгов. Жители постояно чем то не довльны а сами как ебанаты ходят по улицам и ездиют как долбаебы. Рекоменду эту игру❤️❤️❤️❤️❤️❤️❤️❤️❤️❤️❤️❤️❤️❤️,True,0,0,0.5,2269,3,1780481973
226968774,949230,russian,"Уже играю давно, очень много наиграл на пиратке и вот основные моменты:  Оптимизация отсутствует, спустя 3 года игра ставит раком любые сборки, для меня уже здесь 30 фпс ощущаются как все 120 Моды, в отличие от первой части тут у них меньше функционала Баги и вылеты здесь наше все, без мода на анархию даже обычный город не построить из-за кривых хитбоксов Но графика хорошая, интересная проработка симуляции, именно этим и приманивает игра Советую ли купить? Наверное все таки да",True,0,0,0.5,3776,6,1780345665
226790586,949230,russian,It is a cool city builder but i really think that there are better city builders out there with more mechanics like ANNO or Tropica. But overall it is a pretty good sequel to the first game and i do think that it needs more content (free updates paradox not dlc's) like the first game had,True,0,0,0.5,2316,13,1780157333
226773236,949230,russian,"Значительно лучше, чем на релизе. Игра уже не кажется сырой, ощущается вполне достойно. Присутствуют баги, но их уже намного меньше. Хочется добавления новых механик",True,1,0,0.5,4474,2,1780142798
226762466,949230,russian,ja,True,0,0,0.5,1536,7,1780131575
226756693,949230,russian,ыпяварчапо,True,0,0,0.5,2912,2,1780124362
226688855,949230,russian,"A very detailed, realistic game. 5/5. I'm very pleased that the game has a new government. And I hope it will sparkle with new colors. To support the developers, I will purchase all the released DLS. Thank you.",True,0,0,0.47413790225982666,4831,2,1780052613
226623216,949230,russian,игра норм но запустилась на 5 или 7 раз,True,0,0,0.5,888,6,1779975250
226613118,949230,russian,"With the release of updates, the game becomes a fully-fledged product",True,0,0,0.47413790225982666,18527,4,1779963006
226567244,949230,russian,"+- нормис, ток надо все таки допилить игру",True,0,0,0.5,2700,27,1779905392
226551215,949230,russian,"решил построить город на островке,через 3 минуты затопило н@♥♥♥,на моем пк фпс мало",True,0,0,0.5,783,29,1779890679
226542181,949230,russian,"Игра хорошая, залипательная, много возможностей, довольна требовательная, но для комфортной игры нужно устанавливать моды которые в принципе легко установить",True,0,0,0.5,8236,1,1779880310
226203573,949230,russian,"в последнее время радуют фиксы и внимание разработчика к игре. сама игра - топ симулятор градостроения, на мой взгляд. Побольше бы готовых развязок шоссе и разнообразие станций (не за овермного денег, а просто так)",True,0,0,0.476190477609634399,4926,2,1779521754
226100553,949230,russian,♥♥♥♥♥♥♥♥ игра для тех кто любит майнкрафт и все подобное поначалу нехуя не понимал потом 6 часов провел,True,1,0,0.509878396987915039,2172,3,1779402923
225916690,949230,russian,Нраица,True,0,0,0.5,7567,9,1779195900
225877023,949230,russian,слайд-шоу симулятор,True,0,0,0.476190477609634399,619,5,1779143746
225852456,949230,russian,"хорошее продолжение серии игр, но проблема в движке, он не рассчитан на такие крутые игры из за этого баги, искажение моделей и частый вылет игры, новые механики и абгрейт старых зашёл",True,0,0,0.5,2256,13,1779120834
225847952,949230,russian,отличная игра отмыл все деньги как единая россия,True,0,0,0.5,6854,5,1779116887
225822357,949230,russian,когда в игру добавят стихийное бедствие в виде прилета дронов ?,True,1,3,0.523809552192687988,705,4,1779083023
225801106,949230,russian,"На самом деле очень залепательный градостроительный симулятор, с очень крепким геймплейным ядром, чудесной графикой и потрясающим потенциалом под модификацию, и огромными возможностями возводить крайне красивые и реалистичные города, единственное что разочаровывает слабая оптимизация, но новые разработчики уже плотно взялись за решение этой проблемы, я не оставляю надежды на будущее улучшение этого аспекта игры, но уже сейчас могу заверить что при наличии хорошего компьютера эта игра оставит прорву чудесных эмоций игроку!",True,0,0,0.5,3009,25,1779055761
225734887,949230,russian,"топчик, кто не играет тому сильно сочувствую",True,0,0,0.5,1026,1,1779000567
225659979,949230,russian,wse ponraviloss,True,0,0,0.5,2230,1,1778935788
225636919,949230,russian,Моя любимая градостроительная игра. Ещё никогда я так с удовольствием не строил города.   11 крашей из 10👍👍👍,True,0,0,0.5,11583,5,1778912845
225523344,949230,russian,Отличная игра! Залипать одно удовольствие!,True,0,0,0.5,8741,14,1778807534
225496992,949230,russian,It’s absolutely enjoy,True,0,0,0.5,2814,9,1778785783
225395611,949230,russian,ОЧЕН панравилось игра топ саветую,True,0,0,0.5,1191,3,1778666964
225382138,949230,russian,"В принципе я доволен игрой. Жаль, что дорого стоит(( Но затягивающая игра)",True,0,0,0.5,619,3,1778642501
225357328,949230,russian,"очень крутая игра, построил благовещенск на основе деревни, получилась деревня похожая на бородавку за МКАДом",True,7,7,0.583071410655975342,1554,1,1778611179
225342516,949230,russian,мне не въебало метеоритом прямо в густонаселёный район👎,True,0,0,0.5,2632,7,1778596533
225332672,949230,russian,имба,True,0,0,0.5,3816,2,1778585062
225327948,949230,russian,super,True,0,0,0.5,4168,1,1778577472
225319524,949230,russian,да,True,0,0,0.5,701,1,1778561431
225289307,949230,russian,"При всех объективных минусах, это некстген для градостроев.",True,1,0,0.522058844566345215,2079,50,1778522379
225231631,949230,russian,"игра конечно хорошая,. однако оптимизация просто отвратительная, вне зависимости от настроек игры при численности населения от 100к у тебя будет 20 кадров и куча фризов, однако механики прикольные, полная свобода творчества, рекомендую только пользователям с очень мощным процессором с большим объемом л3 кэша",True,2,0,0.545454561710357666,2209,33,1778447683
225179654,949230,russian,Заебись,True,0,0,0.5,2187,4,1778400888
225135866,949230,russian,Игра неплохая видно что начали хоть немного оптимизировать ее думаю скоро эту игру доведут до идеала,True,1,0,0.523809552192687988,2005,34,1778352540
225027014,949230,russian,Ok,True,0,0,0.5,3728,1,1778239886
224979025,949230,russian,Генератор пробок 10/10,True,0,0,0.476190477609634399,14485,1,1778177257
224966753,949230,russian,"НИЧЕРТА не работающая херня!! (Внимание только моды!) Игра топ, согласен. НО твою мать, стоит установить 1... 1 Карл! Сразу ошибка и писец, нифига ничего не работает, и либо у меня супер сраный комп, либо игра полнейшее гавно, кал, я хз что еще сказать! Теперь игра вообще не запускается придется через, грёбаный сайт удалять их с плейлиста. Надеюсь что эти криворукие люди-Paradox Interactive, засунет себе эту игру, извиняюсь но мать вашу. Карл господи мод-магазин который вы делаете, в нем почти каждый второй мод вызывает ошибку игры, вылет или вообще так что вы просто пока моды через сайт не уберете моды вы туда не зайдете. Ребят/люди, прошу вас максимально репостить, делать посты о данной проблеме, что бы все могли нормально играть. Да я знаю что это тупая идея и т.д. но если нас заметят и что-то сделают будет просто офигенно! Спасибо за внимание! -если вы вообще нашли мой обзор...",True,0,0,0.5,7885,2,1778166011
224767389,949230,russian,.,True,0,0,0.483675956726074219,1955,9,1777911335
224717334,949230,russian,!!!,True,0,0,0.483675956726074219,6667,1,1777846800
224708137,949230,russian,да,True,1,0,0.487068533897399902,571,34,1777838186
224701907,949230,russian,ахн,True,0,0,0.483675956726074219,1044,1,1777833484
224665839,949230,russian,Ощутил себя мэром после того как отрубил им воду,True,1,0,0.523809552192687988,945,10,1777803374
224577783,949230,russian,имба правда пробок много,True,0,0,0.5,674,1,1777713235
224566261,949230,russian,когда-нибудь я научусь делать нормальные развязки...,True,0,0,0.5,4717,11,1777698547
224548948,949230,russian,Отличная игра.,True,0,0,0.5,21407,3,1777677545
224543002,949230,russian,"В 26 году играется нормально, моды завезли в виде paradox mods внутри игры, что позволяет играть без инвалидной коляски, которая была на выходе игры.",True,0,0,0.5,7746,7,1777671607
224510599,949230,russian,48,True,0,0,0.5,1065,5,1777644385
224505003,949230,russian,"Хороший градострой, как по мне так удобней и комфортней первой части, электричество и вода в коммуникациях через трубы это просто огонь! Графика шикарная, производительность норм. Новые разрабы надеюсь доведут игру то идеала.",True,3,2,0.556339919567108154,190,4,1777639339
224437096,949230,russian,"Лагает, механики сломаны, графон такой себе, ассетов мало, контент режут и продают отдельно... но при этом я не могу остановится в неё играть.  Это НЕ симулятор, это прога для генерирования городов и видов на них. С модами под пивко самое оно.    Кто хочет именно стратегию-симулятор, лучше пропустить.",True,6,0,0.582488119602203369,5915,3,1777565359
224364174,949230,russian,тут можно топить людей говном 10\10,True,2,2,0.54356849193572998,3513,2,1777477462
224353066,949230,russian,"Лучше именно градостроя я не встречал, есть шероховатости, но они не то что-бы значительны и разрабы в целом в этом направлении работают, правда есть одно НО. Игра вообще не оптимизирована, если вы обладаете относительно мощным пк, это не значит что вы можете выкрутить все ползунки на макс и в 1080р получить 60 кадров, в лучше случае будет 30-40 на пустой карте, когда вы застроитесь на 40-50к жителей они упадут до 20-30 в редких случаях бывает и того меньше, и в чтоб это пофиксить разрабы чёт делали только на старте, когда совсем уж не возможно было в неё играть, причём графика я бы не скзаал что прям какая-то хорошая. Если вам нравится строить, то  это ваш выбор, но готовьтесь либо к шакальному графону, либо к 20фпс",True,0,0,0.5,16999,13,1777466311
224225489,949230,russian,"Определенно рекомендую, крутая игра где строишь город, ты типо мэр и все такое, экономика и т.д. класс",True,2,1,0.466526955366134644,2779,8,1777308497
224167195,949230,russian,рекомендую. много модов и широкий выбор построек. идеальная игра,True,3,2,0.515678107738494873,2531,3,1777231327
224127974,949230,russian,"Кайф игрушка. Ценник завышен, но по скидке очень даже. Из минусов.. Гигантский город, начинает... ""Замедляться"". То есть не лагает именно, а замедляется с третьей скорости. Кроме того очень переусложненное создание поездов. Депо занимает очень много места, а поездов там не слишком много. Также очень больно работать с транспортом. Делаешь по сути в слепую по пробкам. Банально из-за того, что не видно ОТКУДА едет машина. Очень странно работают парковки. Большой поток идет из-за города. Что это значит - непонятно. Но в любом случае играбельно, с кайфом  UPD: Есть все же проблема с тем, что город реально гигантский. Контролировать полностью его невозможно. Ощущение, что ты пытаешься его настроить, но в рандомный момент рандомные ситуации приводят к тому, что где-то что-то не работает. Понять проблема ли в планировании или в случайности невозможно. И моральная ценность района начинает падать. Так как таких домой и районов много у тебя, построить еще один район кажется делом 10 минут. Ощущение в первой части от города были лучше все же",True,1,0,0.483818113803863525,2462,4,1777197148
224076247,949230,russian,супер,True,0,0,0.5,2364,4,1777139951
224069425,949230,russian,имба,True,0,0,0.5,1347,24,1777134576
224063386,949230,russian,круто города 2,True,0,0,0.5,12312,46,1777129645
224026364,949230,russian,"отличная игра, до идеала конечно далеко",True,0,0,0.5,4530,20,1777087033
224019751,949230,russian,"Симулятор строительства ПГТ.  Если сравнивать с оригинальной Skylines - ощущение, что вместо современного Мегаполиса игра принципиально хочет чтобы ты строил ПГТ.   Создаёшь велодорожку. И тут велодорожку. Ещё тут велодорожку. Рабочий класс отказывается жить в нормальных домах, строим общагу китайского образца. Это будет единственный небоскрёб. Подземный пешеходный переход? Сносим пол квартала с каждой стороны. И велодорожку тоже под землю, разумеется. Строим трамвай с мостиками, называем ""Монорельс"", грустим.  Василий Пупкин работает детективом в полицейском участке. Следим за его переездом в домик за городом. Фермы. Половину времени разбиваем поля так, чтобы было красиво. Трансформаторы и деревянные столбики ЛЭП, без них низзя. Ещё следим за прокладкой труб канализации. Смотрим на ДТП, которая перекрыла пол города, на всякий случай делаем из двухполосной дороги трёхполосную, чтобы всё встало намертво..  Достопримечательности? Есть. Бухачечная ""У бабы Нади"" на перекрёстке улицы Галактического Содружества и переулка Теодора Рузвельта. Между панельками прокладываем грунтовку и втыкаешь избушки частного сектора, ибо без этого в городе отток рабочей силы. Ставим мусороперерабатывающий комбинат чтобы все ароматы дули на поселение. Торжественно строим первую парковку с солнечными панелями, для которой пришлось снести сарай Зинаиды Петровны. Героически открываем офисы в зданиях, размерами и сферой напоминающих ларьки Куры Грыль, называем это офисный сектор. Перед основной развязкой ставим табличку ""Добро пожаловать в Нижние Бздюковичи"".",True,1,2,0.513888895511627197,1536,4,1777078779
223894016,949230,russian,Купил без скидки и не жалею ни  о чём,True,0,0,0.5,3874,39,1776928547
223850135,949230,russian,топ,True,0,0,0.5,1262,15,1776871644
223847591,949230,russian,игра для миллионеров,True,1,0,0.52173912525177002,1601,11,1776869187
223794622,949230,russian,"Так как я не играл в 1ю , то рекомендую эту игру",True,0,0,0.5,7220,5,1776797383
223699269,949230,russian,В целом игра хорошая,True,0,1,0.5,967,86,1776688530
223698591,949230,russian,Со всеми минусами - нормальная игра.,True,0,0,0.5,1440,3,1776687729
223678422,949230,russian,"Очень хорошая игра. озёра с говном, построить БАМ своими руками и это всё в 1 метре друг от друга",True,1,0,0.523809552192687988,15595,9,1776656026
223628792,949230,russian,Chill Synonym Literally,True,1,0,0.514563083648681641,3800,42,1776609254
223597789,949230,russian,"Да, но на слабые пк не подходит",True,0,0,0.5,611,10,1776580106
223556740,949230,russian,Построил город и его затопило,True,0,0,0.5,837,12,1776536478
223407488,949230,russian,топ за свои деньги,True,0,0,0.5,1314,1,1776384518
223359409,949230,russian,классная игра,True,0,0,0.5,3051,2,1776328394
223328990,949230,russian,"Отлично! Правда говна нет, хотелось бы, чтобы было",True,1,1,0.503225803375244141,18699,1,1776282505
223104588,949230,russian,моча,True,1,1,0.523809552192687988,2197,4,1775999317
223091909,949230,russian,"висела игра 2 года в списке желаемого, оно и к лучшему теперь игра стала лучше.",True,1,0,0.523809552192687988,1975,18,1775986054
223004485,949230,russian,не мылся 5 дней,True,1,0,0.523809552192687988,3816,6,1775896242
222963072,949230,russian,Bro the best game ever,True,0,0,0.5,11405,9,1775846108
222949182,949230,russian,"Конечно, очень есть очень много механик их первой части которых до сих пор нет во второй, но я надеюсь что и её потихоньку допилят.",True,0,0,0.5,9152,9,1775833613
222929316,949230,russian,"Рекомендации однозначно! Но было бы полезно разработчикам внести дополнение в игру в виде дополнительных функций на примере мода ""траффик"", что бы была возможность смены выбора направления полос на дорогах... Не охота моды добавлять сторонние... Почему бы не внести самые полезные дополнения в игру официально без стороннего софта?!",True,0,0,0.5,17272,1,1775808769
222922471,949230,russian,Яобожаю строить города,True,1,0,0.52173912525177002,2363,8,1775796369
222875912,949230,russian,Оно даже тут не регает,True,0,1,0.5,1667,16,1775742147
222841459,949230,russian,Love this game,True,0,0,0.5,4971,1,1775689856
222824869,949230,russian,"Машины ездят как пьяные, в Махачкале траффик более реалистичный, чем в этой игре, 2 часа перестраивались из 4 полосы в первую, рекомендую!!!!1!!!1!",True,1,0,0.523809552192687988,10288,4,1775671686
222813837,949230,russian,eeeeeeeeeeeeeeeeeeeeeeeeeeeeeeeeeeeee,True,0,0,0.5,1630,1,1775661296
222809638,949230,russian,"Игра неплохая, есть большие изменения в графике, моделировании, физике и т.п. по сравнению с первой части, имеются проблемы и не хватает оптимизации и исправления багов, несмотря на имеющиеся проблемы, мне лично понравилось играть во вторую часть.",True,0,0,0.498338848352432251,13903,7,1775657364
